{
  "id": "TASK-057-T3-FT-003-W2",
  "title": "Authenticate display-client Bearer credentials",
  "status": "done",
  "wave": "W2",
  "feature": "FT-003",
  "reqs": ["REQ-SEC-001"],
  "depends_on": ["TASK-041-T3-FT-003-W1"],
  "touched_files": ["src/face_moment/serving_control/", "src/face_moment/entrypoints/realtime.py", "tests/serving_control/"],
  "tier": "T3",
  "gates": [
    {"name": "Python typecheck", "command": "docker compose run --rm --no-deps backend python -m mypy src/face_moment", "required": true},
    {"name": "Display Bearer authentication tests", "command": "docker compose run --rm backend python -m pytest tests/serving_control/test_display_client_auth.py", "required": true},
    {"name": "Memory Bank architecture lint", "command": "node scripts/mb-lint.mjs", "required": true}
  ],
  "verify": [
    {
      "stage": "verify",
      "attempt": 1,
      "verdict": "PASS",
      "completed_at": "2026-08-16T15:48:11+05:00",
      "summary": "Fresh independent T3 verification after Execution Attempt 2 passed active authoritative principal projection, uniform 401 for missing/malformed/unknown/reset/inactive credentials, body spa_id override rejection, deterministic token/IP 429 with window reset, SELECT-only credential-state access, redacted URL/log markers, disposable cleanup and forbidden-scope review at stable HEAD d5ff38f.",
      "protocol": ".protocols/TASK-057-T3-FT-003-W2/verification.md",
      "report": ".tasks/TASK-057-T3-FT-003-W2/TASK-057-T3-FT-003-W2-S-VERIFY-final-report-docs-01.md"
    },
    {
      "stage": "red-verify",
      "attempt": 2,
      "verdict": "semantic-fail",
      "completed_at": "2026-08-16T15:58:00+05:00",
      "summary": "Fresh adversarial verification found two task-local defects: a normal dirty SQLAlchemy Session autoflushes an UPDATE before auth SELECT, and missing versus syntactically valid unknown credentials have distinguishable query/timing paths (0.0152 ms vs 1.2571 ms, 82.9x). Task remains open for bounded correction; no lifecycle or queue change was made.",
      "protocol": ".protocols/TASK-057-T3-FT-003-W2/red-verification.md",
      "report": ".tasks/TASK-057-T3-FT-003-W2/TASK-057-T3-FT-003-W2-S-RED-VERIFY-final-report-docs-01.md"
    },
    {
      "stage": "closure",
      "verdict": "blocked",
      "completed_at": "2026-08-16T16:18:00+05:00",
      "summary": "The external Docker/Buildx progress gap that blocked Attempt 3 is resolved: the operator produced current image face-moment:manual-20260817 on the healthy desktop-linux builder. The bounded correction and fresh RED remain preserved. Resume with a fresh /exe TASK-057 using the current image, then fresh /verify and separate /red-verify; do not reuse older attempts or old image.",
      "evidence": [
        ".tasks/TASK-057-T3-FT-003-W2/TASK-057-T3-FT-003-W2-S-EXECUTE-final-report-code-03.md",
        ".protocols/TASK-057-T3-FT-003-W2/handoff.md"
      ]
    },
    {
      "stage": "verify",
      "attempt": 2,
      "verdict": "PASS",
      "completed_at": "2026-08-17T23:40:00+05:00",
      "summary": "Fresh independent verification on the operator-provided current image passed the auth contract matrix, focused regression probe, mypy, lint, cleanup and forbidden-scope review. Missing, malformed, unknown, reset-old and inactive credential paths returned the required non-disclosing outcomes; valid principal projection and rate-limit behavior passed.",
      "protocol": ".protocols/TASK-057-T3-FT-003-W2/verification.md",
      "report": ".tasks/TASK-057-T3-FT-003-W2/TASK-057-T3-FT-003-W2-S-VERIFY-final-report-docs-02.md"
    },
    {
      "stage": "red-verify",
      "attempt": 3,
      "verdict": "semantic-pass",
      "completed_at": "2026-08-17T23:47:00+05:00",
      "summary": "Fresh adversarial review passed the corrected no-autoflush read boundary, uniform invalid-credential query shape, immutable row-authoritative principal, body override rejection, deterministic rate limits, redaction and cleanup. No material semantic finding remains; kiosk crash evidence is outside TASK-057.",
      "protocol": ".protocols/TASK-057-T3-FT-003-W2/red-verification.md",
      "report": ".tasks/TASK-057-T3-FT-003-W2/TASK-057-T3-FT-003-W2-S-RED-VERIFY-final-report-docs-01.md"
    },
    {
      "stage": "closure",
      "verdict": "done",
      "completed_at": "2026-08-17T23:48:46+05:00",
      "summary": "Scheduler closed TASK-057 after fresh functional PASS and required T3 semantic-pass using the operator-provided current image. The earlier semantic-fail and external Docker/Buildx blocker were resolved within the accepted task scope; no kiosk/runtime crash issue is attributed to this task.",
      "evidence": [
        ".tasks/TASK-057-T3-FT-003-W2/TASK-057-T3-FT-003-W2-S-VERIFY-final-report-docs-02.md",
        ".tasks/TASK-057-T3-FT-003-W2/TASK-057-T3-FT-003-W2-S-RED-VERIFY-final-report-docs-01.md"
      ]
    }
  ],
  "docs": [".memory-bank/domains/display-client-access.md", ".memory-bank/contracts/boundary-map.md", ".memory-bank/features/FT-003.md", ".memory-bank/tasks/plans/IMPL-FT-003.md"],
  "evidence_required": [
    "display-client-access.md#authentication-contract RED: no display Bearer adapter exists; GREEN: exactly one Authorization Bearer candidate is hashed and matched to one active display_client, produces only id plus authoritative spa_id, rejects missing/malformed/unknown/reset/inactive credentials uniformly with 401, rejects body spa_id override, enforces deterministic positive per-token/IP limits with 429, and redacts token/header/digest from URLs and logs; decisive comparison: credential-state/override/rate-limit fixtures compare principal/status and scan captured logs; artifact: focused pytest and redacted scans under .tasks/TASK-057-T3-FT-003-W2/."
  ],
  "purpose": "Implement the reusable realtime display-client authentication guard after credential persistence exists.",
  "success_outcome": "A current active display token authenticates to the correct immutable principal while every invalid state is uniform, rate-limited and non-leaking.",
  "anti_goals": ["Do not mutate credential lifecycle or expose token_value.", "Do not implement Admin settings, multipart validation or domain admission.", "Do not introduce PKI, pairing, distributed limiter storage or a new auth framework."],
  "runtime_context": {
    "forbidden_scope": ["Credential writes owned by TASK-041-T3-FT-003-W1", "Admin read/handoff owned by TASK-058 and TASK-059", "Realtime admission owned by TASK-045-T3-FT-003-W3"],
    "stop_conditions": ["Uniform 401 cannot be preserved.", "Correct auth requires a foreign writer or new framework.", "Redaction cannot prevent credential/header/digest leakage."]
  },
  "source_artifacts": [".memory-bank/domains/display-client-access.md#authentication-contract", ".protocols/FT-003/plan.md", ".memory-bank/tasks/plans/IMPL-FT-003.md"],
  "normative_inputs": [".memory-bank/domains/display-client-access.md#authentication-contract", ".memory-bank/contracts/boundary-map.md#authentication-and-data-specific-delivery", ".memory-bank/contracts/boundary-map.md#http-failure-contract"],
  "constraints": ["Consume TASK-041 repository read boundary; never write credential state.", "Use deterministic positive limits in tests and no limiter queue/distributed store.", "Use disposable credentials and clean them without touching operator/default rows."],
  "invariants": ["Principal spa_id comes only from the authenticated active row.", "All invalid credential states are non-disclosing 401.", "Token/header/digest never enter URL or logs."],
  "verification_targets": [".memory-bank/domains/display-client-access.md#verification-targets", "Credential-state/override/rate-limit boundary matrix.", "Redacted URL/log scan and read-only owner review."]
}
