{
  "id": "TASK-053-T2-FT-003-W5",
  "title": "Branch outcomes with stale discard and fresh retry",
  "status": "done",
  "wave": "W5",
  "feature": "FT-003",
  "reqs": ["REQ-CAP-001", "REQ-UX-004", "REQ-REL-001"],
  "depends_on": ["TASK-052-T2-FT-003-W4"],
  "touched_files": ["client/", "tests/client/"],
  "tier": "T2",
  "gates": [{"name": "Memory Bank architecture lint", "command": "node scripts/mb-lint.mjs", "required": true}],
  "verify": [
    {"stage": "closure", "verdict": "blocked", "completed_at": "2026-08-16T13:24:31+05:00", "summary": "Transitive dependency TASK-052-T2-FT-003-W4 is blocked by TASK-046-T3-FT-003-W2; TASK-053 cannot be promoted or executed through the blocked sensor/trigger path.", "evidence": [".memory-bank/tasks/TASK-052-T2-FT-003-W4.task.json", ".memory-bank/tasks/TASK-046-T3-FT-003-W2.task.json"]},
    {"stage": "functional", "verdict": "FAIL", "completed_at": "2026-08-19T10:50:28+05:00", "summary": "Independent controller probes pass, but the production capture/request flow never emits the task-owned request-start/response/transport events or calls the outcome controller; real responses are therefore discarded as stale and cannot restore advertising, violating FT-003-AC-007.", "evidence": [".tasks/TASK-053-T2-FT-003-W5/verifier-outcome-probe.mjs", ".tasks/TASK-053-T2-FT-003-W5/browser-outcome-result.json", ".tasks/TASK-053-T2-FT-003-W5/TASK-053-T2-FT-003-W5-S-DEBUG-final-report-docs-01.md", "client/app.js", "client/realtime-attempt.js", "client/trigger-series.js"]},
    {"stage": "functional", "verdict": "FAIL", "completed_at": "2026-08-19T12:22:28+05:00", "summary": "Fresh verifier probes confirm the production wiring and controller behavior, but the correction collects one-clock timing markers in client/app.js even though the canonical FT-003 ownership plan and TASK-066 assign marker collection to TASK-066 alone. This observed ownership violation prevents PASS for TASK-053.", "evidence": [".tasks/TASK-053-T2-FT-003-W5/TASK-053-T2-FT-003-W5-S-VERIFY-final-report-docs-01.md", "client/app.js", ".protocols/FT-003/plan.md", ".memory-bank/tasks/TASK-066-T2-FT-003-W5.task.json"]},
    {"stage": "functional", "verdict": "PASS", "completed_at": "2026-08-20T20:45:21+05:00", "summary": "Fresh verifier-owned controller and real central-origin browser probes prove FT-003-AC-007 typed non-success/transport recovery, stale discard, fresh-capture eligibility and minimal result holding without success cooldown. TASK-053 now consumes the TASK-066 timing seam without owning marker collection.", "evidence": [".protocols/TASK-053-T2-FT-003-W5/verification.md", ".tasks/TASK-053-T2-FT-003-W5/TASK-053-T2-FT-003-W5-S-VERIFY-final-report-docs-02.md", ".tasks/TASK-053-T2-FT-003-W5/verifier-production-path-result-attempt-3.json", ".tasks/TASK-053-T2-FT-003-W5/verifier-outcome-probe.mjs"]},
    {"stage": "closure", "verdict": "done", "completed_at": "2026-08-21T11:49:58+05:00", "summary": "Explicit lifecycle owner closed TASK-053 after independent T2 verification PASS. Typed non-success and transport recovery, stale discard, fresh-capture eligibility and minimal result holding are accepted; no success cooldown or notice behavior is owned here.", "evidence": [".protocols/TASK-053-T2-FT-003-W5/verification.md", ".tasks/TASK-053-T2-FT-003-W5/TASK-053-T2-FT-003-W5-S-VERIFY-final-report-docs-02.md"]}
  ],
  "docs": [".memory-bank/features/FT-003.md", ".memory-bank/states/lifecycle-map.md", ".memory-bank/testing/client-realtime.md", ".memory-bank/tasks/plans/IMPL-FT-003.md"],
  "evidence_required": [
    "FT-003-AC-007 RED: submitted attempts have no typed outcome lifecycle; GREEN: timeout, disconnect, late response and every admitted non-success never replace a newer state, return directly to advertising, start no success cooldown and permit only a new capture/series for retry, while a typed result enters the minimal non-personal holding state; decisive comparison: injected sequences compare state order, stale discard, capture identity and cooldown eligibility without asserting communication-notice presentation; artifact: Playwright transcript and state logs under .tasks/TASK-053-T2-FT-003-W5/."
  ],
  "purpose": "Own typed outcome branching, stale-response protection and fresh-retry/cooldown semantics independently of communication UI.",
  "success_outcome": "Non-success and transport failure safely restore advertising with fresh-capture eligibility, and late work cannot replace current state.",
  "anti_goals": ["Do not implement or time the communication notice.", "Do not render Promo/QR or success cooldown.", "Do not replay requests, reuse captures or add a durable retry/offline queue."],
  "runtime_context": {
    "forbidden_scope": ["Notice presentation owned by TASK-067-T2-FT-003-W6", "Named dependency composition owned by TASK-055-T2-FT-003-W7", "Promo/QR presentation owned by FT-005"],
    "stop_conditions": ["Branching requires response-prose parsing.", "Stale protection cannot hold for the accepted one-request path.", "Retry cannot require a fresh capture without adding a queue."]
  },
  "source_artifacts": [".memory-bank/features/FT-003.md#FT-003-AC-007", ".protocols/FT-003/plan.md", ".memory-bank/tasks/plans/IMPL-FT-003.md"],
  "normative_inputs": [".memory-bank/features/FT-003.md#ft-003-ac-007--fresh-retry-and-failure-cooldown-semantics", ".memory-bank/states/lifecycle-map.md#automatic-attempt-and-display", ".memory-bank/contracts/realtime-attempt-api.md#response-version-1", ".memory-bank/testing/client-realtime.md#client-state-and-recovery-proof"],
  "constraints": ["Use installed playwright cli with real and intercepted typed responses.", "Branch on HTTP status and typed outcome, never prose.", "Use disposable profiles/Attempts and retain state logs."],
  "invariants": ["Stale responses never replace newer state.", "Every retry uses a fresh reference series.", "Non-success starts no success cooldown and owns no notice behavior."],
  "verification_targets": ["FT-003-AC-007 timeout/disconnect/late/non-success state sequences.", "Fresh capture identity and immediate eligibility comparison.", "Minimal result-holding seam without Promo rendering."]
}
